베트남 하노이 자유여행 가볼만한곳 랜선여행!,https://blog.naver.com/jdhrg?Redirect=Log&logNo=222321317390,2021.04.24.," 하노이 자유여행 가볼만한곳하노이 랜선여행  오늘은 해외여행의 추억도 되살릴겸 일주일에 한번정도씩 업로드하고있는 랜선여행 시리즈중 저번 베트남 하롱베이에 이어 하노이 자유여행 가볼만한 곳 리스트입니다. 일반적으로 유명한 관광지도 있고 한국분들이 잘 안가는 관광지도 함께 다뤄볼 예정이에요. ​ 1. 성요셉 성당 2. 호아로 수용소 3. 호안끼엠 호수공원 4. 덴 응옥 선 5. 호치민 관저 6. 호치민의 묘&바딘광장 7. 베트남군 역사박물관 8. 쩐꾸옥 사원 9. 문묘&국립대학교 10. 하노이 맥주거리​​ 1. 성요셉 성당성당 St. Joseph's Cathedral   ​프랑스 식민지배 당시 프랑스 건축가의 설계로 지어진 성당인 성요셉 대성당은 외부에서 바라보면 거무스름한 모습을 가진 화려하지 않은 오래된 장소이다. 노트르담 대성당과 비슷한 외관을 가지고 있는 것으로도 유명하다. 대성당 인근에는 다양한 투어 업체들과 유명한 식당들이 존재하므로 첫 여행의 거점으로 잡아도 좋은 장소이다.​ 성요셉 성당40 Nhà Chung, Hàng Trống, Hoàn Kiếm, Hà Nội 100000 베트남 ​​ 2. 호아로 수용소 Hoa Lo Prison   ​프랑스 식민지배 당시 독립운동가들을 수용하던 형무소를 박물관의 형식으로 꾸며둔 장소이다. 프랑스의 베트남 식민지배의 역사를 볼 수 있는 장소이며, 한국으로 따지면 서대문형무소와 비슷한 느낌을 받을 수 있다.​ 호아로 형무소1 Hoả Lò, Trần Hưng Đạo, Hoàn Kiếm, Hà Nội, 베트남 ​​ 3. 호안끼엠 호수공원 Hoan Kiem Lake Park  ​호안끼엠 호수는 베트남 하노이 방문시 몇 번은 거쳐 지나가는 곳이다. 호수를 둘러싸고 있는 공원은 산책로로 조성되어있어 날씨가 좋은날 강변을 산책하기에도 좋고, 밤에는 화려한 조명아래 야경을 즐기기에도 좋은곳이다. 신한은행 앞에 내려 덴 응옥선이 위치한 장소까지 천천히 걸어가며 호수를 산책해 보는것는 것을 추천한다.​ 호안끼엠 호베트남 Hanoi, 호안끼엠 Hang Trong, 호안끼엠 호 ​ 4. 덴 응옥 선 Den Ngoc Son   ​호안끼엠 호수내부에는 덴 응옥 선이라는 사원이 위치해있습니다. 작은 사원이지만 호수 안쪽의 섬으로 이어진 다리를 통해 들어가 볼 수 있기에 호수를 전체적으로 조망 가능하고, 섬 내부의 사원이라는 이색적인 모습을 확인 할 수 있는 장소입니다.​ 응옥썬사당Đinh Tiên Hoàng, Hàng Trống, Hoàn Kiếm, Hà Nội 100000 베트남 ​ 5. 호치민 관저(주석궁) Nha San Bac Ho   ​하노이에는 호치민과 관련된 관광지가 모여있어요. 호치민 주석궁 > 바딘광장&호치민 묘 순서로 보면 좋은 관광루트입니다. 개인적으로는 하노이의 관광지중 가장 매력적인 관광지라 생각되며 주석궁 내부에는 호치민이 업무를 보던 장소부터 주거공간, 그리고 그를 위해 꾸며진 정원과 호수까지 다양한 풍광을 느껴볼 수 있습니다. 베트남식의 정원으로 꾸며진 전체 부지는 다른 국가의 궁전 정원들과는 다른 색다른 매력을 확인 할 수 있습니다.​ 주석궁Số 2 Hùng Vương, Ngọc Hồ, Ba Đình, Hà Nội 118708 베트남 ​ 6. 호치민의 묘&바딘광장묘&바딘광장 Ho Chi Minh Mausoleum&Quang truong Ba Dinh   ​공산주의 국가들의 공통점은 거대한 광장이 위치해있다는 점인 것 같아요. 러시아의 혁명광장들과 중국의 여러 광장들의 경우와 같이 말이에요. 하노이의 바딘광장 또한 비슷한 의미를 가진 장소인데요! 이곳에는 호치민의 시신을 보관하는 호치민의 묘가 위치해있어 입구가 일부를 제외하고 모두 통제되고있는 장소이기도 합니다. ​입구를 찾기는 어렵지만 바딘광장에는 다양한 시설들과 작은 사원까지 관광지들이 모여있어 둘러보기 좋은 장소에요. 호치민의 묘는 하루에 입장이 가능한 시간이 제한되어있어 반드시 입장시간을 알아보고 방문하는 것을 추천드려요.​ 바딘 광장Hùng Vương, Điện Bàn, Ba Đình, Hà Nội 118708 베트남호찌민 묘소2 Hùng Vương, Điện Bàn, Ba Đình, Hà Nội 100000 베트남못꼿 사원(한기둥 사원)Chùa Một Cột Chùa Một Cột, Đội Cấn, Ba Đình, Hà Nội 100000 베트남 ​ 7. 베트남군 역사박물관 Vietnam Military History Museum   ​깃발탑으로 더 유명한 베트남군 역사박물관은 베트남 독립전쟁부터 베트남전의 역사에 대해 모두 모여있는 역사적인 장소이기도 합니다. 다양한 베트남의 무기 변천사부터 미,중,프 등 아시아권, 서구권 가리지 않는 다양한 국가의 침략전쟁으로 국가를 지켜낸 베트남의 다양한 역사를 감상해볼 수 있는 장소입니다.​ 베트남군역사박물관28A Điện Biên Phủ, Điện Bàn, Ba Đình, Hà Nội, 베트남 ​ 8. 쩐꾸옥 사원 Chua Tran Quoc   ​쩐꾸옥 사원은 하노이 서호에 위치한 절입니다. 6세기에 세워진 건축물로 절 안에는 많은 부도가 서있는 것이 특징입니다. 하노이에서 가장 큰 호수인 서호의 주변은 자전거를 타거나 산책을 즐기는 관광객, 현지인으로 항상 붐비는 장소이고 하노이에서 리조트형 호텔들이 가장 많이 위치한 장소이기도 합니다.​ 쩐꾸옥 사원Đ. Thanh Niên, Yên Phụ, Tây Hồ, Hà Nội 100000 베트남 ​ 9. 문묘&국립대학교 Temple of Literature and National University   ​베트남 최초의 대학으로, 1070년 공자와 그의 제자들을 기리기 위해 세워졌다는 문묘는 대부분 불교 양식의 건축이 대부분인 베트남 사원들중 가장 도교적인 모습을 갖춘 장소입니다. 일반적으로 대학 하면 생각하는 거대한 그리고 높은 건물들은 없지만 자연과 어우러져 차분한 학당과도 같은 모습은 이색적인 분위기를 풍기는 장소이기도 합니다.​ 하노이 문묘58 Quốc Tử Giám, Văn Miếu, Đống Đa, Hà Nội 100000 베트남 ​ 10. 하노이 맥주거리 Ta Hien Beer Street  ​방송출연 이후로 하노이 하면 흔히 생각하는 거리가 된 맥주거리로 따히엔 맥주거리라고도 불리는 장소입니다. 대부분의 방문객은 관광객이며 저렴한 가격의 맥주와 베트남식 술안주를 즐길수도, 고급스러운 분위기의 펍에서 술을 마실수도 있는 장소입니다. 다만, 호객이 워낙 심하고 여성분들의 경우 강제에 가까운 호객이 많아 여성분들끼리의 방문은 비추하는 장소입니다.​ 따히엔 맥주거리Tạ Hiện, Lương Ngọc Quyến, Hàng Buồm, Hoàn Kiếm, Hà Nội 100000 베트남하노이 맥주거리5b Tạ Hiện, Hàng Buồm, Hoàn Kiếm, Hà Nội, 베트남 ​이 외에도 하노이는 동쑤언 시장, 꽌타힌 사원, 탕롱 수상인형극장, 오페라하우스, 외곽으로는 롯데센터 전망대 등 볼거리가 정말 장소입니다. 코로나시국이 끝나고 해외 여행이 가능하게 되면 가격도 부담되지 않고 볼거리도 많은 베트남 하노이 여행은 어떠실까요? "
[베트남 하노이] 열심히 준비한 하노이 여행 마지막 날! _ 사파... ,https://blog.naver.com/minapini?Redirect=Log&logNo=222491913680,2021.09.03.,드디어 하노이 여행 마지막 날!마지막 날에는 저녁 비행기를 타기 위해다시 하노이로 이동해야 했기 때문에이동에 5시간 정도 걸리는 사파에서의 일정을빡빡하게 잡을 수는 없어서 사파 첫날에시간이 늦어져서 못 갔던 함롱산 전망대를 보러 갔다! 입구에서 이렇게 티켓을 구매해서 입장! 이때만 해도 힘들지는 않았는데..  올라가는 중간중간에는 이렇게!포토스팟들도 몇 군데 있었다! 그리고 올라가는 길들!좁은 동굴 같은 길들을 사이사이로 지나가기도 하고울퉁불퉁한 바위들을 넘어서 약간 등산하는기분으로 올라갔던 것 같다!항무아나 이런데 만큼은 아니지만 그래도 꽤.. 힘들더라 그리고 도착한 정상!!날이 흐려서 조금 아쉬웠지만 그럼에도 불구하고 예뻤다!날이 흐려서인지 사람도 우리를 제외하고는한국인 딱 한 팀뿐!!! 그래서 더 좋았다 내가 찍은 친구 사진!  그리고 내려오는 길 한 한국인 가족들을 만났는데어린아이들이 있길래 조금 더 편한 길을 알려드렸더니고맙다고 양손 가득 군밤을 주셨다! 그리고 항무아에서 내려와 호텔에서 짐을 찾고!다시 하노이로 돌아가는 버스를 타러!하노이에서 출발할 때엔 사람들이 별로 없었는데돌아갈 때엔 버스에 타는 사람이 꽤 많았다!  그리고 하노이에 도착하니 벌써 해가 져서 어두워졌다.사파에서 출발하는 버스는 하노이 곳곳에서드랍을 해주는데 원하는 곳에서미리 말하고 내리면 된다. (방송도 해주신다!)​우리는 공항으로 가는 택시를 편하게 잡기 위해사람이 많은 롯데마트에서 내렸다! 공항 도착해서는 짐 붙이기 전에 한번 다시 챙기기..테트리스 왕인 친구 덕에 후다닥 빠르게 챙겼다.하노이에서 산 곰돌이랑 사파에서 산 용용이!  그리고 다시 한국으로!!하노이에서 출발하는 비행기는 00:30에 출발!한국에 도착 한 시간은 오전 6시 30분 정도였다!​​이제 이렇게 하노이 여행도 끝!!이제 남은 밀린 여행들은 일본 여행 2개!삿포로와 마쓰야마가 남았다!​그럼 이제 다음 포스팅은 지난번 포스트에서 예고했듯이다양한 알바썰들!(하지만 마음 변할 수도 있음 ㅎ..)​그럼 이제 그만하노이도 안녕~~~~ 
"하노이 여행,음식점,골프장,렌트카 필수 한글 지도",https://blog.naver.com/mctvn?Redirect=Log&logNo=222558246126,2021.11.04.,"#베트남 #하노이여행을 준비 한다면 먼저 위치를 파악 하고 해당 위치와의 거리 소요시간등을 파알하면 여행 스케줄이 쉬워진다.. 하지만 무작정와서 스케줄을 잡으려면 시간과 이동편 때문에 많은 애를 먹는다.​하노이 시내의 다양한 먹거리 꼭 가봐야 할 곳등 시내여행은 보통 하루나 빠르면 반나절 정도 투어를 하고저녁에는 #롯데빌딩 스카이뷰에서 간단한 맥주나 쥬스 커피 한잔과 야경도 괜찮다..​#하노이시내 여행시 #렌트카업체를 통해서 여행을 할 수 있다 물론 택시나 Grap으로 가능 하지만  택시나 Grap으로이동시 이동 할때 마가 Grap 이나 택시를 잡아야 하고 기다려야 하고 또 베트남은 비 오는날 그랍이나 택시는 잡기어려우며 윗돈을 요구하는게 기본이다 이를 모르고 여행시. 답답함과 짜증이 밀려 올 수 밖에 없다..​현지 지리와 교통정보를 잘 알고 있는 #현지렌트카업체를 통해서 #차량을 렌트하는 것이 편리하며 #기사와같이 렌트를한다.  비용도 저렴 할 뿐만 아니라 시간적으로도 편리하고 기다리는 시간 없이 이동 할 수 있어서 좋다​ ​여행시 필수 아이템 베트남 하노이 한국지도..아래의 구글 지도를 클릭 하시면 원하시는 음식점,골프장,주요시설,렌트카업체등을 쉽게 찾을 수 있습니다https://www.google.com/maps/d/embed?mid=129-GlpBTufMyaGf6f3B8CIPb69wQThKr 하노이 생활의 보물지도 - Google My Maps한국인을 위한 베트남 하노이 생활지도 입니다 하노이 주요시설 찾기 및 길 찾기 식당,커피,마트,제과,호텍,여행,아파트,부동산,은행,주유소,약국,병원,영화관,마사지,가라오케,당구장,골프장,연습장,스크린,학교,학원,문구점등 한인선호 부동산 정보와 임대료 2020년 10월15일 골프장,그린피 Update 2020년 10월16일 대학교정보 Update 카톡상담 광고 및 업체등록 https://open.kakao.com/o/sBo1uIfcwww.google.com 위 지도는 음식점,마트,당구장,호텔,골프장,아파트 및 아파트가격, 부동산,은행,약국,병원,주유소,영화관,마사지,가라오케,안경점스크린골프장,대학교,학원,렌트카 업체까지 하노이에서 생활하면서 거의 모든 장소들이 들어 있습니다.​스마트폰에서도 확인 가능 합니다.​​ ​ "
[베트남 하노이] 2일차1... 당일 투어 일정/유람선 여행 점심/농라,https://blog.naver.com/jyh1751?Redirect=Log&logNo=222556914756,2021.11.03.,"하롱베이 일일투어부지런하게 시작한 하노이 여행의 1일차에 이어, [베트남 하노이] 1일차 - 여행 시작: 미딩 아란헤어(Alan hair) 미용실/성요셉성당/클럽거리 1900/사이공맥주하노이 여행기를 시작해보려고. 동남아시아는 어렸을 때 교회에서 간 필리핀, 25살 때 친구랑 간 캄보디아 ...blog.naver.com 2일차는 1994년에 유네스코 세계자연유산으로 등록된베트남 북부에 있는 만, 하롱베이로 가는 일정이다.​하롱베이에는 1,969개의 크고 작은 섬들과석회암 기둥 등을 포함하고 있다고 한다.​투어는 크게 2가지로 되어 있는 것 같다.​하롱베이 1박2일 크루즈 투어로는 멋진 풍경과일몰과 일출을 볼 수 있는 장점이 있지만,비용은 크루즈의 등급과 식사에 따라서20만 ~ 40만원대로 비싸게 구성된다고 한다.​나처럼 하롱베이 일일투어로 짧게 다녀오는 것은10만원 이하의 금액으로 즐길 수 있다.​하노이 시내에서 하롱베이 선착장까지는약 168 km 떨어져 있으며 차로 2시간 30분이 걸린다. 하노이 오페라 하우스01 Tràng Tiền, Hoàn Kiếm, Hà Nội 100000 베트남할롱 만베트남 꽝닌 Thành phố Hạ Long, 할롱 만  하롱베이 일일투어 손오공카페​내가 참여한 손오공 투어는 아침 9시 50분 경오페라 하우스 정문에서 출발하게 되었다.​자세한 하롱베이 일일투어 이야기는 아래에 써본다. 하노이 성요셉 성당지난 밤에 보았던 성요셉 성당을 지나가게 되었다. 성 요셉 성당낮에 보니깐 조금 느낌이 다르긴 하더라. 하노이 오페라 하우스에 가는길에는터틀타워, 응옥썬사당이 있는 호수 옆을지나가게 되는데 아침부터 애기들이 많다.​부모님들이 애기들이 타는 소방차, 탱크,자동차, 오토바이 등을 조종해주고 있는 모습이다. 하노이 오페라 하우스오늘의 집결지는 위와 같이 생긴 멋진 건물이다. 베트남 하롱베이 손오통 투어하롱베이 일일투어를 진행하는 곳은 여러개 있지만,나는 손오공카페에서 운영하는 투어를 다녀왔다. 하노이 손오공-베트남하노이 자유여행,... : 네이버 카페베트남 하노이자유여행 하노이여행 하노이맛집 하노이호텔 하노이마사지 하노이날씨 하노이항공권,하롱베이cafe.naver.com 베트남 일일 하롱베이 투어목선에서 하는 선상 투어는 조인으로 진행되며,단독으로 운영되는 것은 없다고 하더라.​그니깐 특정한 곳에서 투어를 신청해도결국에는 하롱베이에서는 같은 배를 탄다는 것?​1인 요금은 예약금 1만원 + 79달러,아동 1인은 예약금 1만원 + 30달러이다.​달러는 동으로 대신 낼 수 있는데당시에는 79달러 대신 181만 동을 냈었다. 한국어 가이드, 차량 및 기사, 입장료,점심식사가 포함된 가격이다. 하롱베이 일일투어 일정코스는 픽업부터 시작해서 하롱베이 목선 유람선,선상 씨푸드, 하롱베이 절경을 감사하고 나서승솟(승소트)동굴, 항루원(항루언)투어, 티톱섬을 거쳐서다시 픽업 장소로 되돌아가는 코스이다.​실제로 진행되었던 승솟동굴을 가는 것과항루원의 순서가 바뀌었다.​이번 포스팅에서는 항루언 투어를 가기 전까지의여러가지를 담아볼 예정이다.​하롱베이 선창작으로 가기 전에 휴게소를 들렸다. 하노이 콩카페베트남와서 처음 가본 카페는 콩카페.​유명한거 시킨거 같은데 맛은 기억이 잘 안나네. 하롱베이 선착장선착장에 도착하니 많은 유람선들이 있다. 점점 멀어지는 목선 옆에는 하롱베이 목선우리가 오늘 함께할 배도 정착해 있다.​배에 타면 점심 식사를 바로 시작하게 되는데,이미 음식이 깔아놓아져 있더라. 하롱베이 점심같이 차를 타고 갔던 분들과 식사를 하게 되는데정말 한상 가득히 차려져 있는 음식들이다. 약간 이런 느낌으로 합석을 한다고나 할까.​찐 새우, 새우튀김, 짜조, 생선 요리,회, 상추 등 다양한 요리들이 있다. 하롱베이 다금바리그 중에서도 하이라이트가 되는 이 녀석을 보니깐 다금바리다금바리 특선이라고 해서 주는거더라.​한국에서는 엄청 비싸지만,베트남에서는 나름 합리적이라는 댓글이 있네.​같이 투어를 했던 사람들 중에는 가족 단위도 있고,남자 2명만 놀러온 일행도 있었다.​몇 마디 나누었고 나보다 어렸던거 같다. 이런 사진도 찍어놓았더라.​나는 혼자 왔는데 이분들이 사진을 찍어줘서나름대로 좋은 사진들을 건질 수가 있었다. 베트남 모자 삿갓 - 농라내꺼는 아니지만 다른 분의 삿갓.​이거를 나는 베트남 삿갓이라고 검색하니까,베트남 모자라고 해서 농라 라고 하는데이거 자주 보아도 이름은 처음 알게 되었다.(넝라? 농라? 논? 발음이 뭐지.)​식사를 다하게 되면 배가 출발한다. 약 1시간 정도를 달렸던거 같은데,그 사이에 하롱베이 절경을 감상할 수 있다. 이렇게 2층으로 올라오면 시원한 바람을 맞고,안에서 편하게 갈 수도 있다.​여기서 아까 나랑 사진을 찍었던 분이 찍어줬다.  내 사진을 엄청 남겨본다.  와 나 슬리퍼 신고 갔었구나.  앉아서도 사진을 찍고  뒷모습도 찍어두고, 아까 그 농라도 써보라고 해서 써봤다.  얼굴이 안나와서 그런가 뭔가 느낌이 좋네.​이후로는 DSLR로 찍은 하롱베이 절경을 담아본다. 지나가는 배들도 많고 섬들도 참 많다. 지나가는 배에 탄 사람들도 구경하고. 유람선 같이 보이는 배도 지나가더라. 하롱베이 유람선 투어마지막은 유람선의 베트남 국기로.​다음 포스팅은 하롱베이 일일투어 2번째로,승소트 동굴, 티톱섬, 카약 등을 탄 이야기다. "
"베트남(2019) 하노이여행, 하노이음식,베트남맥주,베트남커피... ",https://blog.naver.com/yangklee?Redirect=Log&logNo=222535962865,2021.10.13.,"티티키​2019년, 베트남항공을 이용하여,베트남 하노이여행에 맛보았던 베트남음식들.베트남쌀국수 포pho , 분짜,반미,반쎄오,분보남보,반꾸온  등등 아득한 베트남음식이름들.그리고 베트남맥주들, 베트남커피,카페의 추억언제나 다시 맛볼꼬......​2021.10 베트남항공 타고 하노이로 간다. 베트남항공 기내식 골든문 호텔 무료조식 하노이 골든문호텔 베트남 쌀국수 포텐 ,포10 쌀국수맛집 ,여행중 두번찾아간집. 베트남 쌀국수가 생각나는 계절. 국물맛도 예술, 훌훌넘어가는 쌀국수. 야채도 신선하고 코코넛 쥬스. 하일랜드 커피 한잔. 호이안 반미. 비아 하노이, 하노이맥주,베트남맥주 오바마  분짜, 흐엉리엔 퍼짜쭈엔 베트남쌀국수,백종원 베트남 계란커피 에그커피 카페지앙. 타이거맥주 꽌앙응온 반쎄오맛집 로컬 카페에서 매일 한잔의 베트남커피 하노이맥주 코펜하겐, 덴마크맥주 분보남보   반꾸온맛집  하노이 하노이병맥주  베트남맥주 1일 1병/캔 하노이 반꾸온 맛집 베트남 쌀국수 1일 1그릇 하노이공항라운지 베트남에서 일본 마차 선토리티. "
하노이 자유여행 (추억 사진 팔이),https://blog.naver.com/hoipoe4?Redirect=Log&logNo=222568769627,6일 전,"​​ 하노이 자유여행 (추억 사진 팔이)​​위드 코로나로 많은 변화가 있는 요즘,,그럼에도 아직 해외 여행은 꺼려질 수밖에 없죠?아무리 백신을 맞았다고 해도 걱정이 되거든요 ㅠㅠ게다가 어린아기가 있다보니 여행은 꿈도 못꾸고 아쉬운 마음에 지난 사진으로 포스팅 해봐요 ㅎㅎ​​ ​​의도치 않게 야시장 구경하다가 들렸던 요셉성당이에요낮보다 밤이 더 예쁘더라고요~​ ​이곳은 베트남 하노이에서 명소라고 불렷던 기찻길 마을이에요​제가 다녀왔을적만 해도 염경환씨가 티비프로그램에서 나와서 소개해주던 커피숍에도 가고 했었는데​지금은 안전상 문제로 기찻길마을이 패쇄조치 되었다고 하더라고요.​​ ​하노이 하면 가장먼저 알고 계실법한 호안끼엠 호수에요~​호수는 이쁘다기 보다는 그냥 호수를 둘러서 시장처럼 이것저것 구경할것이 많아서 많이들 찾는것 같았어요.​​ ​호안끼엠 호숫가 근처에 있는 상가에 위치한포케 맛집이에요.​비주얼 보세요 ㅠㅠ 하나하나 이쁘고 싱싱했어요.​취향에 따라 토핑을 선택할 수 있는데요.기본베이스로 현미밥과 샐러드 반반 베이스로 각가지 야채와 연어나 참치 토핑을 선택할 수 있어요.​ ​​인테리어도 너무 예쁘고, 직원들도 친절하고무엇보다 영어로 대화가 되니 좋더라고요.물론 영어를 잘 하진 못하지만,, 베트남어는정말 알아듣기 힘들었거든요. ㅎㅎ​저기 보이는 나무 뒤로는 호안끼엠 호수 뷰에요~​코로나가 종식된다면 꼭 다시 한번 가고 싶네요오늘의 사진 추억여행은 여기서 마무리 합니다. "
"베트남여행(하노이,서머셋그랜드,기찻길마을,소파카페... ",https://blog.naver.com/heejin756?Redirect=Log&logNo=222565312758,2021.11.11.," 서머셋 그랜드 하노이 도착2베드룸 이그제큐티브 예약 거실,부엌,2베드룸으로 성인 4명이서 쓰기에 부족함 없는 숙소다 숙소도착후 첫끼 이 사진만 보여주면 된다고 ㅎㅎ  기찻길 근처 소파카페하노이에서 먹었던 코코넛커피 중 베스트 콩카페보다 훠어어어얼씬 맛있었음 엄마도 소파카페 코코넛커피 다시 드시고싶다고 ㅎㅎ  뭐가 이리 간절할꼬 집으로 한마리 들임   스파도 하고~  수영못한게 넘 아쉽네  롯데센터에서 선물용, 주전부리, 과일 모두 해결하고 숙소에서 휴식  서머셋그랜드호텔 쾌적,널찍하니 좋음 분위기 좋은 식당~ 약간의 웨이팅은 기대감을 높이지 ㅎㅎ    할머니와 엄마를 숙소에 모셔다드리고 남편과 야시장구경하며 콩카페콩카페도 맛있지만 코코넛커피는 소파카페가 정말루 더맛있다  하롱베이투어하는 날투어내용, 선박의 크기, 룸의 유무, 룸의 테라스 유무 등에 따라 천차만별이라 본인의 취향껏 예약하면 된다당일치기이지만 할머니와 엄마가 계셔서 침대가 있는 투어로 예약     뷔페식 짧막한 쿠킹클래스도 열어준다 테라스~~~ 솔직한 투어후기는 한번쯤 와볼만하지만너무너무너무 더울때는 투어를 하지 않고 호캉스하면서 수영하는게 나은것 같다추천과 비추사이 서머셋은 커피맛집 피곤한 오마니  할머니는 스파 한번더 하시고 우리는 카페에서 수다타임엄마랑 다이어트를 주제로 심도깊은 대화(를 찍는 후니) 입에 물고있으라는데 너무 맛없다 퉤   삼촌찬스로 할머니의 것이었던 일등석~비즈니스석 기내식은 후니에게롷ㅎㅎ할머니는 우리랑 타는게 더 좋으시다능맛좋아보이는구나  할머니 즐거웠던거죵???? 집에 가고싶어보여 ㅎㅎ​#베트남여행 #하노이여행 #서머셋그랜드하노이 #2베드룸이그제큐티브 #소파카페 #하노이기찻길마을 #성요셉대성당 #하롱베이 #하롱베이투어 #나구 #효도여행 #할머니랑여행 "
