"[하노이 맛집] 하노이 여행 필수방문 베트남 음식점, 꽌... ",https://blog.naver.com/chicnawoo?Redirect=Log&logNo=222570411322,4일 전,"​호안끼엠 인근에서 마지막 쇼핑 겸 정처없이 떠돌다가짝퉁가게들 구경 좀 하면서 에어컨 바람 쐬고 나와서는마지막 만찬을 후회없이 남기기 위해서 찾아간 곳,바로 꽌 안 응온이다​하노이 여행이 결정되고나서 김제주한테 하노이 간다고 했더니'그럼 꽌안응온 가야돼!' 라며 적극 추천했다ㅎㅎㅎㅎㅎㅎ승무원 추천 맛집인데, 사실 얘가 말한 곳은 거의 다 맛있어...☆ 일단 믿고 찾아봤지​검색해봤더니 꽌 안 응온 하노이 여행 가면 꼭 한 번은 방문해야한다는 필수코스라고한다!신서유기에도 나왔다던데, 나는 신서유기 그렇게 열심히 본 사람이 아니라 그건 잘 모르겠고넓은 마당같은 곳에서 약간 코다차야 같은 느낌이라는 건 알겠더라ㅎㅎㅎ​택시 타고 꽌안응온 가달라고 했더니 기사님이 바로 찰떡같이 알아들어주셨다ㅠㅠ 감사합니다...택시 아저씨 발음을 중국어 성조 빌려서 옮겨 적자면 꽌(3성) 안(1성) 응온(1성) 정도 되는듯​​ ​​이미 많은 사람들이 내부에 자리잡고 앉아있었지만내 앞에 한 5팀 정도 대기중이었다​ 18 Phan Bội Châu, Cửa Nam, Hoàn Kiếm, Hà Nội 111103 베트남18 Phan Bội Châu, Cửa Nam, Hoàn Kiếm, Hà Nội 111103 베트남 ​Quan An Ngon18 Phan Bội Châu, Cửa Nam, Hoàn Kiếm, Hà Nội 111103 베트남​나는 당연히 줄을 설거라고는 생각조차 안하고 방문했던터라 당혹스러웠지만찾아보니까 미리 예약하고 방문할 수 있다고 한다아래 링크가 미리 예약할 수 있는 링크로, 다행이도 영어로 예약이 가능하다!​선택할 수 있는 꽌안응온이 지점이 3개인데 위 주소에 있는 지점이 내가 방문한 본점인듯​http://quananngon.com.vn/book_table.html?lang=en Quán Ăn Ngonbook-table-title 18 Phan Boi Chau Street, Hoan Kiem District, Hanoi 25T2 Trung Hoa Nhan Chinh, Cau Giay District, Hanoi B2 R6 Vincom Royal City, 72A Nguyen Trai Street, Thanh Xuan District, Hanoi name * phone * email quantity * book_date * hour * message Shop store 18 Phan Boi Chau Street, Hoan Kiem...quananngon.com.vn ​ ​​대체 어떤 식당이길래 하노이 여행 간 사람들이 필수 코스마냥 들리는거니​그런데 꼭 여행객 뿐만이 아니었다...​​ ​​내가 보니까 여기는 하노이 로컬들의 핫플이었다!매장이 엄청 넓었는데 그 넓은 식당이 사람들로 꽉 찼다심지어 관광객으로 보이는 사람은 거의 안보이고, 다 현지인인 것 같더라​​ ​​거의 초등학교 운동장만한 크기의 매장에 좌석이 마련되어있고,그 좌석을 빙- 둘러싸고 직원들이 주문받은 요리를 조리하고 있는 모습을 볼 수 있었다​꼭 전동벨 하나 들고서 원하는 음식을 찾아다니며 주문하는 코다차야랑 비슷한 구조였다ㅎㅎㅎ차이가 있다면 이 하노이 맛집에서는 고객은 테이블에 가만이 앉아서 주문을 하고,직원들이 그 주문받은 메뉴를 조리테이블에 요청한 후조리가 완료되면 그 요리를 픽업하여 다시 각 테이블로 서빙해주는 체계라는 점이다​​ ​​재료를 펼쳐놓고 손님들에게 조리하는 모습을 보여주는게 포장마차 같기도 한데각각의 코너마다 조리하는 요리가 다르다​​ ​​간만에 움짤도 하나 쪄봤다ㅎㅎㅎ​​이 식당은 에어컨 설치가 됐는지는 잘 모르겠지만 에어컨이 없는 것만 못하게 덥다ㅎㅎㅎㅎㅎ왜냐하면​​ ​​이 곳은 천장이 열리는 컨버터블 식당이었다!ㅋㅋㅋㅋㅋㅋㅋㅋㅋㅋㅋ​졸라 힙해......!!!!!!​​비 오면 닫고, 날씨 좋은 날은 천장 뚜껑(?)을 여는 것 같은데,덕분에 나무가 우거진 숲속 캠핑장에서 맛있는 걸 먹는듯한 기분이 난다​​ ​​게다가 천장에 주렁주렁 매달린 전등이언뜻 나무에 열매마냥 매달린걸로 보이기도 해서묘하게 몽롱한 분위기도 나고~​좀 더우면 어때-분위기 최고인데​메뉴판이 거의 노래방 책같이 굉장히 두꺼운데,다행이 영어로 이름과 설명이 적혀있어서 알아보기 어떤 요리인지 알아보기 쉽다베트남어로만 적혀있다면 여차하다간 비둘기 요리 주문하는 불상사가 생길 수도 있어......​​ ​​마지막으로 베트남 현지에서 즐기는 분짜느억맘 소스에 쌀국수는 익히 본 비주얼인데​​ ​​대나무 집게 사이에 돼지고기를 끼워서 통으로 구워낸게냄새부터 예사롭지 않았다​약간 달달한 소스 묻혀서 구운 돼지고기가 꼭 석쇠 불고기 비슷한 냄새가 나서냄새 맡자마자 침나오더만 후후​​ ​​느억맘 소스에 쌀국수와 채소를 푹 담가서 거기에 불향 솔솔 나는 돼지고기를 감싸서 먹으면오진다​갈비에 싸먹는 냉면이랑 동급이라고 봐​​ ​​돼지고기 구이 먹기 좋게 집게에서 분리하다보면돼지고기로 만든 완자도 함께 제공된걸 볼 수 있는데,분짜 먹을 때 이 완자 한번씩 국수에 싸먹는게 또 별미다​​ ​​그리고 쌀국수한국에도 쌀국수집은 많지만, 현지에서 먹는 것 처럼 소고기 넉넉하게 넣어주고국물이 이만큼 진할 수 없기때문에마지막 만찬에서도 쌀국수와 함께했다ㅎㅎㅎㅎㅎ​​ ​​언뜻 봐도 소고기가 그릇에 꽉 차있는걸 볼 수 있다!​한국인들은 고수 맛을 유난히 예민하게 느끼는 유전자가 있다던가.....고수를 좋아하는 사람이 상대적으로 적은데나랑 친척동생들은 전부 고수 잘 먹었닼ㅋㅋㅋㅋㅋㅋㅋㅋㅋㅋㅋㅋㅋㅋ​우리 입맛 무슨일이야우리 외갓집 유전자 무슨일이야...​​  ​​고기가 워낙많아서 1젓가락 1소고기 해줘야했다​​ ​​얇게 저민 소고기 양지얼마다 고기가 그득그득 들었는지,고기만 다 건져내면 흡사 곰탕집 수육 한접시 분량은 되겠더라​하노이 여행 중 먹었던 쌀국수 중에 맛없는 곳은 단 한군데도 없었고어디가 더 맛있는지 우열을 가리기도 참 힘들었다ㅎㅎㅎㅎ​거의 상향평준화 된 국물 맛, 면발의 쫄깃함, 고기 양이었고결국엔 개인 취향에 따라 갈릴 것 같다​​ ​​약간 매콤+달달하게 볶아낸 새우볶음​​ ​​돼지고기 & 소고기에 탄수화물인 쌀국수가 이미 두가지였기때문에나머지 메뉴 하나는 해산물로 하기로 하고 선택한게 바로 새우​바다를 낀 나라라 그런가 새우 품질이 나쁘지 않았고 일단 양념과 잘 어울렸다ㅎㅎㅎㅎ두접시 시킬껄ㅎㅎㅎ​​쌀국수와 분짜 양이 많아서 메뉴를 적게시켰는데도 부족하지 않았고주문한 메뉴 전부 맛있어서 여행 마지막이 아쉽지 않았다!​​▶ 하노이 여행 공항 픽업 / 일일 투어 / 쿠킹클래스 / 스파 알아보기 ◀​​이 하노이 여행 이후로 우리나라에 있는 프랜차이즈 쌀국수에는만족 못하는 미뢰를 가지게 돼버린것 같다...다들 맛은 있는데 뭔가 아쉬워ㅠㅋㅋㅋㅋ 깊은맛이 좀 덜한 느낌이다​​다음주 주말에 친척동생들 만나기로 했는데 간만에 하노이 추억팔이 좀 해야겠다ㅎㅎㅎㅎㅎ포스팅에 안나온 에피소드가 꽤 많았는데 이 에피소드들은 썰을 풀어도 풀어도 웃기다​​썰을 다 못풀어서 아쉽긴한데,뭐 어쨌든 오늘의 하노이 맛집 포스팅은 여기서 마칩니다요그럼 안뇽-뿅!​​ "
베트남 여행 : 하노이 하롱베이 투어 정보 정리 (하롱베이... ,https://blog.naver.com/sesool?Redirect=Log&logNo=222515326405,2021.09.24.,"안녕하세요 세쿨이입니다 :)  오늘의 베트남 여행 이야기는베트남 하노이 여행에서 근교 여행지로 빼놓을 수 없는베트남의 랜드마크 중 하나인하롱베이 투어에 대한 이야기입니다​베트남 하노이에서 출발하는하롱베이 투어 일정과 종류를 비교를 해드리도록 하겠습니다​참고로 제가 했던 투어 후기는다음 글에서 따로 소개해드리도록 하겠습니다 :) * 베트남 하롱베이 투어​베트남 여행의 랜드마크 중 하나인하롱베이를 둘러보는 투어입니다베트남 하노이에서 출발하는 것과 하롱베이 주변(깟파, 하이퐁 등)에서 출발하는 투어들이 있지만자력으로 깟파나 하이퐁을 방문하는 분들은 많지 않기 때문에대부분 하노이에서 출발하고 돌아오는 투어를 이용합니다​하롱베이 투어는 하노이를 기준으로 크게 3가지가 있어요​ 1. 하롱베이 당일투어 (일일투어)2. 하롱베이 1박2일 투어3. 하롱베이 2박3일 투어​투어를 하나씩 소개해드리겠습니다2박 3일투어는 거의 안하기 때문에 간단히 추가 일정만 설명드릴게요  1. 하롱베이 당일투어 (일일투어)​베트남 하노이에서 출발, 하롱베이를 당일치기로 방문한 뒤 돌아오는 투어입니다아침 일찍부터 투어가 진행되며가격이 비싼 투어일수록 소규모로 진행되어요많게는 45인승 버스에 꽉꽉 채워서 가기도 합니다​예전에는 4시간씩 걸려서 이동을 했지만2018년 9월 고속도로가 개통되면서편도 2시간 30분 정도 걸리게 되었습니다 * 하롱베이 당일투어 코스​투어 시간과 스케줄 순서는 여행사마다 상이하지만주요 엑티비티는 거의 동일합니다참고용으로 봐두시면 되겠습니다 7:30 ~ 8:30하노이 숙소 픽업 혹은 미팅 장소 픽업8:30 ~ 11:30하노이 to 하롱베이 이동11:30 ~ 13:30배 승선 및 점심식사 (하면서 배 이동)13:30 ~ 16:30카약 or 뱀부보트 체험띠엔꿍 동굴 or 승솟동굴 구경선착장 복귀16:30 ~ 20:00하노이 복귀 2. 하롱베이 1박2일 투어​크루즈를 타고 하롱베이만으로 나가1박을 하고 올 수 있는 투어입니다.베트남 하노이 여행을 온 분들이가장 많이 선택하는 투어이기도 해요​크루즈에서 1박을 하는 투어와 깟바섬 호텔에서 1박을 하는 투어로 나눠집니다.​크루즈 등급에 따라 가격은 천차만별로 달라지며회사에 따라 코스도 조금씩 다릅니다​가장 큰 장점은 하롱베이에서의 일출과 일몰을 볼 수 있고당일치기 투어보다 조금 더 여유있게 시간이 배정되어 있어여유롭게 더 다양한 엑티비티를 경험할 수 있어요 :)   * 하롱베이 1박2일 투어 코스​역시 투어 시간과 스케줄 순서는 여행사마다 상이하지만주요 엑티비티는 거의 동일합니다 ​1일차 일정7:30 ~ 8:30하노에 숙소 픽업 혹은 미팅 장소 픽업8:30 ~ 11:30하노이 to 하롱베이 이동 11:30 ~ 14:00 배 승선 및 점심식사 (하면서 배 이동) 14:00 ~ 17:30카야킹 or 뱀부보트 체험 (약 1시간 이내)티톱섬 구경 (1시간 내외)프라이빗 비치 해수욕(티톱섬에 포함되는 경우도 있음)17:30 ~ 19:00노을(일몰) 감상 및 티타임, 휴식19:00 ~ 21:00저녁식사 및 오징어낚시21:00 ~휴식 ​2일차 일정~ 07:00기상 (일출은 자유)07:00 ~ 08:00아침식사08:00 ~ 09:00승솟동굴 or 띠엔꿍 동굴(천궁동굴) 구경09:00 ~ 10:30휴식10:30 ~ 12:30베트남롤 쿠킹클래스 & 점심식사13:00 ~ 17:00체크아웃(하선) 및 하노이 복귀 3. 하롱베이 2박3일 투어​베트남 하롱베이 2박3일 투어는 일정이 더 길게 늘어지는 코스라고 보시면 됩니다.크루즈에서 2박을 머물거나크루즈 1박 깟바섬 호텔 1박투어 정도로 나눠집니다.​기존 1박2일 일정에해수욕 시간이 더 주어진다거나 진주 양식장을 들리는 코스가 추가되며섬 일정이 하나 더 추가되기도 합니다.​섬일정이 추가되면 대부분은 동굴투어, 프라이빗 비치에서의 해수욕 정도고조금 더 고급스러운 곳은 자전거 타는 경우도 있답니다 * 하롱베이 투어 비교 ​당일투어1박2일 투어2박3일 투어가격1인당30$ ~ 50$2인실 기준크루즈, 숙소등급따라70$ ~ 250$(1인당 35$ ~ 125$)2인실 기준크루즈, 숙소등급따라120$ ~ 500$(1인당 60$ ~ 250$)피로도높음낮음낮음엑티비티 시간2~30분 내외1시간 내외1시간 이상일출 일몰 구경불가가능가능지루함낮음보통높음특이사항도로사정 따라 하노이서 걸리는 시간은 다름모든 투어는 날씨의 영향을 받음투어회사, 크루즈 업체에 따라 일정은 상이함 만족도는 개인에 따라 다를 수 있지만베트남 하노이 여행과 하롱베이 방문을 같이 준비하신다면1박2일 투어를 적극 추천합니다!​1박2일 하롱베이 투어가 딱 지루하지 않을만큼 구경할 수 있고웬만한 엑티비티를 여유있게 다 즐길 수 있거든요​당일치기 투어는 이른 아침부터 버스를 타고 왕복 5시간을 이상 왔다갔다 하게 됩니다​도로 사정도 안좋기 때문에 승차감이 편한 편이 아니고엑티비티에 주어진 시간도 짧아서여유있는 관광은 어렵습니다.단 하루안에 많은 것을 소화하려다보니여행 피로도를 엄청나게 높이죠.​2박 3일 투어는 정말정말 편하게 휴양하실 분들이나 효도관광이 목적이신 분들만 추천드립니다.하롱베이가 아름답고 지상낙원이라고는 하지만어느 순간부터는 지루함이 더 커질 수 있기 때문입니다 ^^; 조금 더 첨언해드리면 쿠킹클래스, 진주양식장 구경 등은 이게 뭐야? 하고 끝날만한 것들입니다. 동굴들은 우리나라의 석회동굴 정도 ^^;​그럼에도 1박을 하는 이유는 여행 피로도를 줄이고 여유를 조금 더 가질 수 있기 때문입니다.​베트남 여행 일정 상 시간이 별로 없거나하롱베이를 잠시 보는 것만으로도 만족한다면당일투어를 하시는 것도 괜찮습니다 네이버에 하롱베이 투어 검색하면 꽤 여러개가 나오지만믿을만한 여행플랫폼 중 하나인 Klook 투어를 참고용으로 소개해드리겠습니다​대략적인 일정과 가격을 보고 다른 상품과 일정 비교를 해보시기 바랍니다 하롱베이 디럭스 크루즈 (1-3일)Klook Travelwww.klook.com 하롱베이 여행에서 가장 중요한 것은 뭐니뭐니해도 바로 날씨입니다.이건 돈을 줘도 어찌 할 수 없는 부분인데날씨가 안좋으면 크루즈에서 자는 것부터 힘들고주변 풍경을 즐기기도 쉽지 않거든요엑티비티가 취소되는 경우도 있구요​여러분도 좋은 날씨 속에서하롱베이를 멋지게 즐길 수 있기를 바라겠습니다  ​이상으로 베트남 여행 정보베트남 하노이 하롱베이 투어 정보 정리를 마치겠습니다​다음 이야기로 찾아오겠습니다 :) "
